{
  "$schema": "https://json-schema.org/draft/2020-12/schema",
  "title": "Hatch Pet source-bound semantic component annotations v1",
  "type": "object",
  "additionalProperties": false,
  "properties": {
    "schema_version": {
      "type": "integer",
      "const": 1
    },
    "source_sha256": {
      "type": "string",
      "pattern": "^[0-9a-f]{64}$"
    },
    "author": {
      "type": "string",
      "minLength": 1,
      "maxLength": 8192
    },
    "note": {
      "type": "string",
      "minLength": 1,
      "maxLength": 8192
    },
    "orientation": {
      "enum": [
        "front",
        "back",
        "left",
        "right",
        "unknown"
      ]
    },
    "foreground_mask": {
      "oneOf": [
        {
          "type": "object",
          "additionalProperties": false,
          "properties": {
            "path": {
              "type": "string",
              "minLength": 1,
              "maxLength": 8192
            }
          },
          "required": [
            "path"
          ]
        },
        {
          "type": "object",
          "additionalProperties": false,
          "properties": {
            "runs": {
              "type": "array",
              "items": {
                "type": "array",
                "items": {
                  "type": "integer",
                  "minimum": 0
                },
                "minItems": 3,
                "maxItems": 3
              },
              "minItems": 0,
              "maxItems": 250000
            }
          },
          "required": [
            "runs"
          ]
        },
        {
          "type": "object",
          "additionalProperties": false,
          "properties": {
            "polygons": {
              "type": "array",
              "items": {
                "type": "array",
                "items": {
                  "type": "array",
                  "items": {
                    "type": "number"
                  },
                  "minItems": 2,
                  "maxItems": 2
                },
                "minItems": 3,
                "maxItems": 10000
              },
              "minItems": 1,
              "maxItems": 4096
            }
          },
          "required": [
            "polygons"
          ]
        },
        {
          "type": "object",
          "additionalProperties": false,
          "properties": {
            "colors": {
              "type": "object",
              "additionalProperties": false,
              "properties": {
                "values": {
                  "type": "array",
                  "items": {
                    "type": "string",
                    "pattern": "^#[0-9a-fA-F]{6}$"
                  },
                  "minItems": 1,
                  "maxItems": 32
                },
                "tolerance": {
                  "type": "number",
                  "minimum": 0,
                  "maximum": 64
                },
                "seeds": {
                  "type": "array",
                  "items": {
                    "type": "array",
                    "items": {
                      "type": "number"
                    },
                    "minItems": 2,
                    "maxItems": 2
                  },
                  "minItems": 1,
                  "maxItems": 1024
                },
                "within": {
                  "type": "array",
                  "items": {
                    "type": "array",
                    "items": {
                      "type": "array",
                      "items": {
                        "type": "number"
                      },
                      "minItems": 2,
                      "maxItems": 2
                    },
                    "minItems": 3,
                    "maxItems": 10000
                  },
                  "minItems": 1,
                  "maxItems": 4096
                }
              },
              "required": [
                "values"
              ]
            }
          },
          "required": [
            "colors"
          ]
        }
      ]
    },
    "components": {
      "type": "array",
      "items": {
        "type": "object",
        "additionalProperties": false,
        "properties": {
          "id": {
            "type": "string",
            "pattern": "^[a-z0-9][a-z0-9-]{0,95}$"
          },
          "name": {
            "type": "string",
            "minLength": 1,
            "maxLength": 8192
          },
          "category": {
            "type": "string",
            "minLength": 1,
            "maxLength": 8192
          },
          "parent_id": {
            "anyOf": [
              {
                "type": "string",
                "pattern": "^[a-z0-9][a-z0-9-]{0,95}$"
              },
              {
                "type": "null"
              }
            ]
          },
          "z_index": {
            "type": "integer",
            "minimum": -100000,
            "maximum": 100000
          },
          "side": {
            "enum": [
              "left",
              "right",
              "center",
              "unknown"
            ]
          },
          "mask": {
            "oneOf": [
              {
                "type": "object",
                "additionalProperties": false,
                "properties": {
                  "path": {
                    "type": "string",
                    "minLength": 1,
                    "maxLength": 8192
                  }
                },
                "required": [
                  "path"
                ]
              },
              {
                "type": "object",
                "additionalProperties": false,
                "properties": {
                  "runs": {
                    "type": "array",
                    "items": {
                      "type": "array",
                      "items": {
                        "type": "integer",
                        "minimum": 0
                      },
                      "minItems": 3,
                      "maxItems": 3
                    },
                    "minItems": 0,
                    "maxItems": 250000
                  }
                },
                "required": [
                  "runs"
                ]
              },
              {
                "type": "object",
                "additionalProperties": false,
                "properties": {
                  "polygons": {
                    "type": "array",
                    "items": {
                      "type": "array",
                      "items": {
                        "type": "array",
                        "items": {
                          "type": "number"
                        },
                        "minItems": 2,
                        "maxItems": 2
                      },
                      "minItems": 3,
                      "maxItems": 10000
                    },
                    "minItems": 1,
                    "maxItems": 4096
                  }
                },
                "required": [
                  "polygons"
                ]
              },
              {
                "type": "object",
                "additionalProperties": false,
                "properties": {
                  "colors": {
                    "type": "object",
                    "additionalProperties": false,
                    "properties": {
                      "values": {
                        "type": "array",
                        "items": {
                          "type": "string",
                          "pattern": "^#[0-9a-fA-F]{6}$"
                        },
                        "minItems": 1,
                        "maxItems": 32
                      },
                      "tolerance": {
                        "type": "number",
                        "minimum": 0,
                        "maximum": 64
                      },
                      "seeds": {
                        "type": "array",
                        "items": {
                          "type": "array",
                          "items": {
                            "type": "number"
                          },
                          "minItems": 2,
                          "maxItems": 2
                        },
                        "minItems": 1,
                        "maxItems": 1024
                      },
                      "within": {
                        "type": "array",
                        "items": {
                          "type": "array",
                          "items": {
                            "type": "array",
                            "items": {
                              "type": "number"
                            },
                            "minItems": 2,
                            "maxItems": 2
                          },
                          "minItems": 3,
                          "maxItems": 10000
                        },
                        "minItems": 1,
                        "maxItems": 4096
                      }
                    },
                    "required": [
                      "values"
                    ]
                  }
                },
                "required": [
                  "colors"
                ]
              }
            ]
          },
          "pivot": {
            "anyOf": [
              {
                "type": "array",
                "items": {
                  "type": "number"
                },
                "minItems": 2,
                "maxItems": 2
              },
              {
                "type": "null"
              }
            ]
          },
          "attachments": {
            "type": "array",
            "items": {
              "type": "object",
              "additionalProperties": false,
              "properties": {
                "id": {
                  "type": "string",
                  "pattern": "^[a-z0-9][a-z0-9-]{0,95}$"
                },
                "point": {
                  "type": "array",
                  "items": {
                    "type": "number"
                  },
                  "minItems": 2,
                  "maxItems": 2
                },
                "target_id": {
                  "anyOf": [
                    {
                      "type": "string",
                      "pattern": "^[a-z0-9][a-z0-9-]{0,95}$"
                    },
                    {
                      "type": "null"
                    }
                  ]
                },
                "confidence": {
                  "type": "number",
                  "minimum": 0,
                  "maximum": 1
                }
              },
              "required": [
                "id",
                "point",
                "target_id",
                "confidence"
              ]
            },
            "minItems": 0,
            "maxItems": 128
          },
          "confidence": {
            "type": "number",
            "minimum": 0,
            "maximum": 1
          },
          "occlusion": {
            "type": "object",
            "additionalProperties": false,
            "properties": {
              "status": {
                "enum": [
                  "visible",
                  "partial",
                  "unknown"
                ]
              },
              "occluded_by": {
                "type": "array",
                "items": {
                  "type": "string",
                  "pattern": "^[a-z0-9][a-z0-9-]{0,95}$"
                },
                "minItems": 0,
                "maxItems": 128
              },
              "note": {
                "type": "string",
                "maxLength": 16384
              }
            },
            "required": [
              "status",
              "occluded_by",
              "note"
            ]
          },
          "notes": {
            "type": "array",
            "items": {
              "type": "string",
              "minLength": 1,
              "maxLength": 8192
            },
            "minItems": 0,
            "maxItems": 128
          }
        },
        "required": [
          "id",
          "name",
          "category",
          "mask"
        ]
      },
      "minItems": 0,
      "maxItems": 128
    },
    "extensions": {
      "type": "object",
      "maxProperties": 128
    }
  },
  "required": [
    "schema_version",
    "source_sha256",
    "author",
    "note",
    "components"
  ]
}
