{
  "schema_version": 1,
  "source_sha256": "9b66c2c199a61e7aa76574994e5230cca4c566e769bc483124330cda9d08bc49",
  "author": "Hatch Pet deterministic fixture author",
  "note": "Hatch Pet authored synthetic character fixture; not production artwork or model output.",
  "orientation": "left",
  "components": [
    {
      "id": "tail",
      "name": "Tail",
      "category": "anatomy/tail",
      "parent_id": "torso",
      "z_index": 0,
      "side": "center",
      "mask": {
        "path": "truth-masks/tail.png"
      },
      "pivot": [
        118.0,
        61.5
      ],
      "attachments": [],
      "confidence": 1.0,
      "occlusion": {
        "status": "visible",
        "occluded_by": [],
        "note": "Authored visible fixture geometry."
      },
      "notes": [
        "Hatch Pet authored synthetic character fixture; not production artwork or model output."
      ]
    },
    {
      "id": "far-wing",
      "name": "Far Wing",
      "category": "anatomy/wing",
      "parent_id": "torso",
      "z_index": 1,
      "side": "center",
      "mask": {
        "path": "truth-masks/far-wing.png"
      },
      "pivot": [
        87.0,
        25.5
      ],
      "attachments": [],
      "confidence": 1.0,
      "occlusion": {
        "status": "partial",
        "occluded_by": [],
        "note": "Only authored visible pixels are assigned; hidden shape is not supplied."
      },
      "notes": [
        "Hatch Pet authored synthetic character fixture; not production artwork or model output."
      ]
    },
    {
      "id": "far-front-foot",
      "name": "Far Front Foot",
      "category": "anatomy/foot",
      "parent_id": "torso",
      "z_index": 2,
      "side": "center",
      "mask": {
        "path": "truth-masks/far-front-foot.png"
      },
      "pivot": [
        38.5,
        87.5
      ],
      "attachments": [],
      "confidence": 1.0,
      "occlusion": {
        "status": "visible",
        "occluded_by": [],
        "note": "Authored visible fixture geometry."
      },
      "notes": [
        "Hatch Pet authored synthetic character fixture; not production artwork or model output."
      ]
    },
    {
      "id": "far-rear-foot",
      "name": "Far Rear Foot",
      "category": "anatomy/foot",
      "parent_id": "torso",
      "z_index": 3,
      "side": "center",
      "mask": {
        "path": "truth-masks/far-rear-foot.png"
      },
      "pivot": [
        84.0,
        93.5
      ],
      "attachments": [],
      "confidence": 1.0,
      "occlusion": {
        "status": "visible",
        "occluded_by": [],
        "note": "Authored visible fixture geometry."
      },
      "notes": [
        "Hatch Pet authored synthetic character fixture; not production artwork or model output."
      ]
    },
    {
      "id": "torso",
      "name": "Torso",
      "category": "anatomy/torso",
      "parent_id": null,
      "z_index": 4,
      "side": "center",
      "mask": {
        "path": "truth-masks/torso.png"
      },
      "pivot": [
        69.5,
        64.5
      ],
      "attachments": [],
      "confidence": 1.0,
      "occlusion": {
        "status": "partial",
        "occluded_by": [],
        "note": "Only authored visible pixels are assigned; hidden shape is not supplied."
      },
      "notes": [
        "Hatch Pet authored synthetic character fixture; not production artwork or model output."
      ]
    },
    {
      "id": "near-front-foot",
      "name": "Near Front Foot",
      "category": "anatomy/foot",
      "parent_id": "torso",
      "z_index": 5,
      "side": "center",
      "mask": {
        "path": "truth-masks/near-front-foot.png"
      },
      "pivot": [
        50.0,
        87.5
      ],
      "attachments": [],
      "confidence": 1.0,
      "occlusion": {
        "status": "visible",
        "occluded_by": [],
        "note": "Authored visible fixture geometry."
      },
      "notes": [
        "Hatch Pet authored synthetic character fixture; not production artwork or model output."
      ]
    },
    {
      "id": "near-rear-foot",
      "name": "Near Rear Foot",
      "category": "anatomy/foot",
      "parent_id": "torso",
      "z_index": 6,
      "side": "center",
      "mask": {
        "path": "truth-masks/near-rear-foot.png"
      },
      "pivot": [
        94.0,
        89.0
      ],
      "attachments": [],
      "confidence": 1.0,
      "occlusion": {
        "status": "visible",
        "occluded_by": [],
        "note": "Authored visible fixture geometry."
      },
      "notes": [
        "Hatch Pet authored synthetic character fixture; not production artwork or model output."
      ]
    },
    {
      "id": "head",
      "name": "Head",
      "category": "anatomy/head",
      "parent_id": "torso",
      "z_index": 7,
      "side": "center",
      "mask": {
        "path": "truth-masks/head.png"
      },
      "pivot": [
        29.5,
        48.5
      ],
      "attachments": [],
      "confidence": 1.0,
      "occlusion": {
        "status": "partial",
        "occluded_by": [],
        "note": "Only authored visible pixels are assigned; hidden shape is not supplied."
      },
      "notes": [
        "Hatch Pet authored synthetic character fixture; not production artwork or model output."
      ]
    },
    {
      "id": "horns",
      "name": "Horns",
      "category": "anatomy/horn",
      "parent_id": "head",
      "z_index": 8,
      "side": "center",
      "mask": {
        "path": "truth-masks/horns.png"
      },
      "pivot": [
        31.5,
        25.5
      ],
      "attachments": [],
      "confidence": 1.0,
      "occlusion": {
        "status": "visible",
        "occluded_by": [],
        "note": "Authored visible fixture geometry."
      },
      "notes": [
        "Hatch Pet authored synthetic character fixture; not production artwork or model output."
      ]
    },
    {
      "id": "eye",
      "name": "Eye",
      "category": "face/eye",
      "parent_id": "head",
      "z_index": 9,
      "side": "center",
      "mask": {
        "path": "truth-masks/eye.png"
      },
      "pivot": [
        23.0,
        44.5
      ],
      "attachments": [],
      "confidence": 1.0,
      "occlusion": {
        "status": "visible",
        "occluded_by": [],
        "note": "Authored visible fixture geometry."
      },
      "notes": [
        "Hatch Pet authored synthetic character fixture; not production artwork or model output."
      ]
    },
    {
      "id": "nostril",
      "name": "Nostril",
      "category": "face/nostril",
      "parent_id": "head",
      "z_index": 10,
      "side": "center",
      "mask": {
        "path": "truth-masks/nostril.png"
      },
      "pivot": [
        12.0,
        54.0
      ],
      "attachments": [],
      "confidence": 1.0,
      "occlusion": {
        "status": "visible",
        "occluded_by": [],
        "note": "Authored visible fixture geometry."
      },
      "notes": [
        "Hatch Pet authored synthetic character fixture; not production artwork or model output."
      ]
    },
    {
      "id": "near-wing",
      "name": "Near Wing",
      "category": "anatomy/wing",
      "parent_id": "torso",
      "z_index": 11,
      "side": "center",
      "mask": {
        "path": "truth-masks/near-wing.png"
      },
      "pivot": [
        70.0,
        40.0
      ],
      "attachments": [],
      "confidence": 1.0,
      "occlusion": {
        "status": "partial",
        "occluded_by": [],
        "note": "Only authored visible pixels are assigned; hidden shape is not supplied."
      },
      "notes": [
        "Hatch Pet authored synthetic character fixture; not production artwork or model output."
      ]
    },
    {
      "id": "flank-spots",
      "name": "Flank Spots",
      "category": "detail/marking",
      "parent_id": "torso",
      "z_index": 12,
      "side": "center",
      "mask": {
        "path": "truth-masks/flank-spots.png"
      },
      "pivot": [
        89.0,
        66.5
      ],
      "attachments": [],
      "confidence": 1.0,
      "occlusion": {
        "status": "visible",
        "occluded_by": [],
        "note": "Authored visible fixture geometry."
      },
      "notes": [
        "Hatch Pet authored synthetic character fixture; not production artwork or model output."
      ]
    }
  ],
  "extensions": {
    "fixture_name": "creature",
    "fixture": true
  }
}
